[
  {"ticker":"CMIG4","name":"CIA ENERGETICA DE MINAS GERAIS - CEMIG","cvm_code":"2453","cnpj":"17.155.730/0001-64","sector":"Energia eletrica","subsector":"Energia eletrica","segment":"Geracao, transmissao e distribuicao","share_class":"PN","currency":"BRL","ri_url":"https://ri.cemig.com.br"},
  {"ticker":"TAEE11","name":"TRANSMISSORA ALIANCA DE ENERGIA ELETRICA S.A.","cvm_code":"20257","sector":"Energia eletrica","subsector":"Transmissao","segment":"Energia eletrica","share_class":"UNIT","currency":"BRL","ri_url":"https://ri.taesa.com.br"},
  {"ticker":"BBAS3","name":"BANCO DO BRASIL S.A.","cvm_code":"1023","cnpj":"00.000.000/0001-91","sector":"Bancos","subsector":"Intermediacao financeira","segment":"Bancos","share_class":"ON","currency":"BRL","ri_url":"https://ri.bb.com.br"},
  {"ticker":"ITUB4","name":"ITAU UNIBANCO HOLDING S.A.","cvm_code":"19348","sector":"Bancos","subsector":"Intermediacao financeira","segment":"Bancos","share_class":"PN","currency":"BRL","ri_url":"https://www.itau.com.br/relacoes-com-investidores"},
  {"ticker":"BBDC4","name":"BANCO BRADESCO S.A.","cvm_code":"906","sector":"Bancos","subsector":"Intermediacao financeira","segment":"Bancos","share_class":"PN","currency":"BRL","ri_url":"https://www.bradescori.com.br"},
  {"ticker":"BBSE3","name":"BB SEGURIDADE PARTICIPACOES S.A.","cvm_code":"23159","sector":"Seguradoras","subsector":"Seguros","segment":"Seguradoras","share_class":"ON","currency":"BRL","ri_url":"https://ri.bbseguridaderi.com.br"},
  {"ticker":"VALE3","name":"VALE S.A.","cvm_code":"4170","sector":"Mineracao e commodities","subsector":"Minerais metalicos","segment":"Mineracao","share_class":"ON","currency":"BRL","ri_url":"https://www.vale.com/pt/investidores"},
  {"ticker":"PETR4","name":"PETROLEO BRASILEIRO S.A. PETROBRAS","cvm_code":"9512","sector":"Petroleo e gas","subsector":"Petroleo, gas e biocombustiveis","segment":"Commodity","share_class":"PN","currency":"BRL","ri_url":"https://www.investidorpetrobras.com.br"},
  {"ticker":"LREN3","name":"LOJAS RENNER S.A.","cvm_code":"8133","sector":"Varejo","subsector":"Comercio","segment":"Varejo moda","share_class":"ON","currency":"BRL","ri_url":"https://www.lojasrennersa.com.br/ri"},
  {"ticker":"MGLU3","name":"MAGAZINE LUIZA S.A.","cvm_code":"22470","sector":"Varejo","subsector":"Comercio","segment":"Varejo ecommerce","share_class":"ON","currency":"BRL","ri_url":"https://ri.magazineluiza.com.br"},
  {"ticker":"SAPR11","name":"COMPANHIA DE SANEAMENTO DO PARANA - SANEPAR","cvm_code":"18627","sector":"Saneamento","subsector":"Agua e saneamento","segment":"Utilidade publica","share_class":"UNIT","currency":"BRL","ri_url":"https://ri.sanepar.com.br"},
  {"ticker":"SBSP3","name":"CIA SANEAMENTO BASICO EST SAO PAULO - SABESP","cvm_code":"14443","sector":"Saneamento","subsector":"Agua e saneamento","segment":"Utilidade publica","share_class":"ON","currency":"BRL","ri_url":"https://ri.sabesp.com.br"},
  {"ticker":"ITSA4","name":"ITAUSA S.A.","cvm_code":"7617","sector":"Holding","subsector":"Holdings diversificadas","segment":"Holding","share_class":"PN","currency":"BRL","ri_url":"https://ri.itausa.com.br"},
  {"ticker":"BRAP4","name":"BRADESPAR S.A.","cvm_code":"18724","sector":"Holding","subsector":"Holdings diversificadas","segment":"Holding","share_class":"PN","currency":"BRL","ri_url":"https://www.bradespar.com.br"},
  {"ticker":"KLBN4","name":"KLABIN S.A.","cvm_code":"12653","cnpj":"89.637.490/0001-45","sector":"Papel e Celulose","subsector":"Madeira e Papel","segment":"Papel e Celulose","share_class":"PN","currency":"BRL","ri_url":"https://ri.klabin.com.br"},
  {"ticker":"KLBN3","name":"KLABIN S.A.","cvm_code":"12653","cnpj":"89.637.490/0001-45","sector":"Papel e Celulose","subsector":"Madeira e Papel","segment":"Papel e Celulose","share_class":"ON","currency":"BRL","ri_url":"https://ri.klabin.com.br"},
  {"ticker":"KLBN11","name":"KLABIN S.A.","cvm_code":"12653","cnpj":"89.637.490/0001-45","sector":"Papel e Celulose","subsector":"Madeira e Papel","segment":"Papel e Celulose","share_class":"UNIT","currency":"BRL","ri_url":"https://ri.klabin.com.br"}
]
